type,audio,hyperlink_1,hyperlink_1_text,hyperlink_2,hyperlink_2_text,images_working,image_1,image_2,text,excerpt,title,credit,lat,long,gps_working,category
Text & Image,,,,,,N,https://lh3.googleusercontent.com/-ndZdAqJXYTs/VIVp0Is5DRI/AAAAAAAAAcg/AAlxHG2hCo0/s421/Audubon1919.jpg,,"""Seward Park will be made, as near as possible, into a pace of absolute security for Seattle song birds. In fact the officers of the Audubon Society hope that its fame will spread abroad and the feathered tourists may be converted into permanent residents. The plan for the bird sanctuary started before the United States declared war on Germany. ... Seward Park was selected because of its ideal location and because Lake Washington at that point is already a government preserve. ... Its beauty is of the sort that birds like--not artificially made lawns and carefully planted flower beds--but of Nature's outlay of scraggly trees, with a generous smattering of berry bushes. ...As soon as weather conditions permit the entrance to the park will be decorated with a beautiful archway.... Boys with airguns cannot enter. It will be the deadline for cats. The members of the society are thinking of ways and means to make crows and blackbirds know they are not wanted. ... Permission to kill cats has been denied the Audubon Society, but the enactment of an ordinance requiring the licensing of cats, it is believed, will eliminate the one big enemy of the birds.""","""Seward Park will be made, as near as possible, into a place of absolute security for Seattle song birds.""","""Seward Park is Made Inviting for Songsters""","Seattle Sunday Times, 1919",47.558416,-122.253249,,culture
Text & Image & Link,,http://www.seattle.gov/util/EnvironmentConservation/ClimateChangeProgram/ProjectedChanges/Sea-LevelRiseMap/index.htm,Ever higher.,,,"N ""Image Unavail""",http://cdn.c.photoshelter.com/img-get/I0000fLFFZPeXyQ8/s/900/900/Mew-Gull-Seward-Park-Seattle-9703.jpg,,"The coast draws us all--children, elders, dogs, mew gulls. The water pulls us. Our actions pull the water. Ever higher into the Anthropocene.","The coast draws us all--children, elders, dogs, mew gulls. The water pulls us. Our actions pull the water. Ever higher into the Anthropocene.",In Shallow Water,"Thomas Bancroft, 2014",47.548805,-122.256403,,ecology
Text & Image,,,,,,N,https://lh5.googleusercontent.com/-mkE7xYbQR6o/VIVds-joK4I/AAAAAAAAAcE/QCTySSZly34/s720/RevMurphyFishingPier.JPG,,"In the aftermath of World War I, the Mount Baker neighborhood (just northwest of Sqebeqsed) decided to forbid Japanese-American residents. Reverend Ulysses Grant Murphy, of the Columbia Congregational Church, tried to stop them. He failed. He continued his pro-tolerance campaign through World War II.","In the aftermath of World War I, the Mount Baker neighborhood (just northwest of Seward Park) decided to forbid Japanese-American residents.",Reverend Murphy's Fishing Pier,"Wendy Call, 2014",47.560833,-122.255278,,culture
Image & Text,,,,,,N,https://lh5.googleusercontent.com/-Ba0e_pUvJz4/VIYYqqXoIaI/AAAAAAAAAdQ/B_r06s_Fna8/s576/IMG_2422.JPG,,"In the 1930s, white neighbors of Seward Park complained about Japanese Americans moving to the neighborhood. In the 1970s, the Japanese prime minister gifted Seattle with one thousand cherry trees and these lanterns. These days, people sometimes tuck into the lanterns burning slips of paper on which they have written their regrets.","In the 1970s, the Japanese prime minister gifted Seattle with one thousand cherry trees and these lanterns.",Lanterns Over Andrew's Bay,"Wendy Call, 2014",47.551398,-122.259555,N,culture
Image & Text,,,,,,?,https://lh5.googleusercontent.com/-7AWF-k6LpBQ/VIVUC8_cTPI/AAAAAAAAAaw/wTRLclKZ2D0/s576/CallaLily2.JPG,,"The  Xachua'bsh who lived near the Sqebeqsed peninsula harvested camas lilies and pounded their root-bulbs to make soup, cakes, and bread. Camas lilies refused to grow if the forest was allowed to grow up around them.",The  Xachua'bsh who lived near the Sqebeqsed peninsula harvested camas lilies…,Camas Lilies,"Wendy Call, 2014",47.549167,-122.252778,?,ecology
Image & Text,,,,,,N,https://lh4.googleusercontent.com/-H3iq3P5JMRI/VIVdSWDhsnI/AAAAAAAAAeM/RiF00525eM0/s576/FireHydrant.JPG,,"The Xachua'bsh (Lake People) who lived near Sqebeqsed burned parts of the forest, so the landscape would give them sustenance. Fire swept the peninsula in the late 1400s and in the early 1800s.","The Xachua'bsh (Lake People) who lived near Sqebeqsed burned parts of the forest, so the landscape would give them sustenance. Fire swept the peninsula in the late 1400s and in the early 1800s.",Corey Hydrant,"Wendy Call, 2014",47.561111,-122.254722,,culture
Image & Text,,,,,,N,https://lh4.googleusercontent.com/-Uv4FyNibXds/VIYrpDAxVQI/AAAAAAAAAd8/f50okyhwlHQ/s576/PullingScotchBroom.jpg,,"Al Smith comes to the park nearly every day to pull out invasive plants. He has done this for years. ""After the Parks Department removed the ivy and blackberry, they hoped the bleeding heart would spread. But instead, the fancy ragwort, creeping buttercup, and other noxious weeds did."" -- Al Smith, May 4, 2013",Al Smith comes to the park nearly every day to pull out invasive plants. He has done this for years.,No Bleeding Heart,"Wendy Call, 2013",47.549167,-122.252778,,ecology
Image & Text,,,,,,N,https://lh5.googleusercontent.com/-uSH5jtTwGaw/VIT_XSjfAsI/AAAAAAAAAZQ/8-gamzthUS8/s555/SDT1925UplandsAnnounce.jpg,https://lh5.googleusercontent.com/-SG-iDszo7uI/VIYYftuMk3I/AAAAAAAAAdI/dXCQ2hDJeUM/s720/IMG_2420.JPG,"The Seward Park Uplands neighborhood was to be framed by four stone gateways. ""Four artistically developed entrance to the Uplands are being developed,"" the Seattle Times told readers in 1925. One had been already been completed, ""built of Wisconsin sandstone, imported here at great expense to carry out exactly the design and ideas of the architect."" Today, there is only one gateway.","The Seward Park Uplands neighborhood was to be framed by four stone gateways. ""Four artistically developed entrance to the Uplands are being developed,"" the Seattle Times told readers in 1925.",Juneau Street Uplands Entrance,"Wendy Call, 2014",47.549444,-122.267222,,landscape
Image & Text,,,,,,N,https://lh5.googleusercontent.com/-86ZbRYmrXbo/VIYYKi5gUsI/AAAAAAAAAcw/CjV1CDTJQzA/s512/IMG_2400.JPG,,"I had always wondered about the grand gateway at the intersection of Orcas Street and Seward Park Ave. Why an entrance to Seward Park so far from it? It wasn't to welcome people to the park at all, but to enclose the Seward Park Uplands neighborhood. ",I had always wondered about the grand gateway at the intersection of Orcas Street and Seward Park Ave. Why an entrance to Seward Park so far from it? ,Orcas Street Uplands Entrance,"Wendy Call, 2014",47.550833,-122.261944,,landscape
Image & Text,,,,,,,http://digitalcollections.lib.washington.edu/utils/ajaxhelper/?CISOROOT=seattle&CISOPTR=723&action=2&DMSCALE=80&DMWIDTH=512&DMHEIGHT=472&DMX=0&DMY=0&DMTEXT=&DMROTATE=0,,"They chopped and they chopped. Six hundred workers arrived at Seward Park during the Depression, hands hungry for saws and axes and a government paycheck. It was twice as many able bodies as were wanted; too many trees came down. Great old firs and cedars, hot with life, exhaled final breaths. ",They chopped and they chopped. Six hundred workers arrived at Seward Park during the Depression…,Cutting Cauldron,"Seattle Photograph Collection, 1934",47.551667,-122.256389,,landscape
Text & Link,,http://contemplativetherapy.com.au/2008/04/two-poetic-openings-wright-and-levertov/," Denise Levertov's poem ""A Reward.""",,,,,,"For who-knows-how-many years, a single great blue heron has come to balance on the old piling here. The heron flies into Denise Levertov's poem ""A Reward."" And yes, seeing that ""widewinged"" bird wings the spirit wide open. ","For who-knows-how-many years, a single great blue heron has come to balance on the old piling here.",Widewinging Heron,,47.553333,-122.254167,,culture
Text & Link,,http://articles.latimes.com/1997-06-08/books/bk-1127_1_denise-levertov," as Denise Levertov has told us, ""what one receives from living close to a lake.""",,,,,,"For most of my life I've lived within easy distance of saltwater coast: Atlantic, Pacific, or Gulf. The few years that I did not, worry welled inside me like a river dammed. Now living on the hill between lake and brackish bay, I understand, as Denise Levertov has told us, ""what one receives from living close to a lake."" For me, it is not always enough. ",For most of my life I've lived within easy distance of saltwater coast…,Fresh Waterside,,47.559161,-122.248423,,landscape
Text & Link,,http://www.washington.edu/uwired/outreach/cspn/Website/Classroom%20Materials/Reading%20the%20Region/Northwest%20Schools%20of%20Literature/Commentary/18.html,"Denise Levertov's poem ""Settling.""",,,,,,"My seven-year-old goddaughter and I sit in a café, more than a mile from Seward Park, but still holding Sqebeqsed in mind. I read her Denise Levertov's poem ""Settling."" She tips her head at the line ""Grey is the price / of neighboring with eagles."" This child has always lived close to eagles, always cupped small hands around her eyebrows on sunny days and complained of rays piercing her eyes. She is confused. How is that a price? she wants to know. ","My seven-year-old goddaughter and I sit in a café, more than a mile from Seward Park, but still holding Sqebeqsed in mind.",Empire Espresso,,47.558511,-122.284242,,culture
Text & Link & Image,,http://nonchurchychurchpoems.wikispaces.com/file/view/Morning+Mist.pdf,the morning mist,,,,https://lh3.googleusercontent.com/Di18o5jKNpahlpKQTQdgj2-MEo5Cgv935NUgIGoJ6HM=w276-h207-p-no,,"Some mornings, I must whisper to myself that yes, Sqebeqsed is still there, though there is nothing but that belief visible in the fogwhite sheet of air. A yoga teacher tells me she goes to Seward as often as she can; it is her church. In the morning mist, believing the peninsula will still be there when I arrive is the only faith I can summon.","Some mornings, I must whisper to myself that yes, Sqebeqsed is still there, though there is nothing but that belief visible in the fogwhite sheet of air.",Fogwhite Whisper,"Wendy Call, 2015",47.554722,-122.261389,,landscape
Image & Text,,,,,,,https://lh6.googleusercontent.com/-Dr0VdyhjjFI/VNDIl52m74I/AAAAAAAAAj0/VKSIGCl-DA4/s512/Fish_ponds_under_construction_at_Seward_Park_Seattle_June_18_1935.jpg,https://lh3.googleusercontent.com/-79MTW6yJuTM/VIVUO6JccZI/AAAAAAAAAiY/Cu6C4219qBQ/w700-h523-no/FishPond.JPG,"UFOs land in an old-growth forest, bringing unwelcome fish obtruders to Lake Washington. ","UFOs landing in an old-growth forest, bringing unwelcome fish obtruders to Lake Washington. ",UFOs,"Federal Emergency Relief Photographs, 1935 and Wendy Call, 2014",47.551389,-122.258889,,culture
Image & Text,,,,,,,https://lh3.googleusercontent.com/-aEj_asDMyog/VNDJStVctmI/AAAAAAAAAkI/k3wYCkNYf8k/s512/Flute_player_at_Earth_Day_gathering_in_Seward_Park_Seattle_April_1971.jpg ,,A piper plays to the earth-lovers on the second Earth Day.,A piper plays to the earth-lovers on the second Earth Day.,Pied Piper,"Paul Thomas, Seattle Post-Intelligencer, 1971",47.549722,-122.251667,,culture
Image & Text,,,,,,,https://lh3.googleusercontent.com/-S5ewxtA84kk/VNDJSTmh9PI/AAAAAAAAAkU/b0FMEyYufDU/s576/Log_shelter_construction_at_Seward_Park_Seattle_January_3_1934.jpg,,"Most of Seward Park's picnic shelters are straightforward single-square affairs, built for one family to celebrate simple events. Picnic Shelter 3 is a mansion of a place, with the rustic version of a courtyard and multiple rooms. At the peak of Pinoy Hill, it hosted not a family, but an entire community. ","Most of Seward Park's picnic shelters are straightforward single-square affairs, built for one family to celebrate simple events. ",Pinoy Picnic Shelter,"Emergency Relief Photographs, 1935",47.551944,-122.255278,,culture
Image & Text,,,,,,,https://lh4.googleusercontent.com/-G_7Y5Sx5O2g/VNDJS_Lg_8I/AAAAAAAAAkQ/0p9QR07yAh0/s576/Seward_Park_swimming_float_construction_Seattle_January_2_1934.jpg,,"I pick up my goddaughter from school on her birthday. We can go anywhere in the neighborhood for her birthday afternoon, I tell her, where does she choose? ""Swimming in Seward Park!"" she says. Late January, summer dreams still fill her mind. ",Swimming in Seward Park! she says.,Swimming in Seward Park,"Emergency Relief Photographs, 1935",47.554167,-122.254722,,culture
Image & Text,,,,,,,https://lh4.googleusercontent.com/-vmHw_grIuqY/VNDJSdkirOI/AAAAAAAAAkM/zxWFc-l4PT8/s576/Seward_Park.jpg,,"Two low cement platforms lie underfoot, masqueraded by moss, semi-colonized by small cedars. The platforms once supported a Japanese torii. A group of Seward Park lovers plans to build a new torii for Sqebeqsed. This one will cost nearly a quarter of a million dollars. ","Two low cement platforms lie underfoot,  masqueraded by moss, semi-colonized by small cedars. ",Original Torii,"Kyo Kyoke, 1936",47.55,-122.257222,,culture