type,audio,hyperlink_1,hyperlink_1_text,hyperlink_2,hyperlink_2_text,images_working,image_1,image_2,text,excerpt,title,credit,lat,long,gps_working,category
Audio &Text,"<iframe width=""100%"" height=""166"" scrolling=""no"" frameborder=""no"" src=""https://w.soundcloud.com/player/?url=https%3A//api.soundcloud.com/tracks/166005226&amp;color=ff5500&amp;auto_play=false&amp;hide_related=false&amp;show_comments=true&amp;show_user=true&amp;show_reposts=false""></iframe>",,,,,,,,"Late morning, on an early August day, a group of children walked along with their two summer camp leaders, known as Caveman and Porcupine. They tumbled along Sqebeqsed Trail. A man stood in the forest duff, playing a rustic metal sitar and singing.","Late morning, on an early August day, a group of children walked along with their two summer camp leaders, known as Caveman and Porcupine. ",Heard Along Sqebeqsed Trail,"Wendy Call, 2014",47.553254,-122.251092,N,culture
Image & Text,,,,,,?,https://lh6.googleusercontent.com/-laz6IzwfUwc/VAqNJ-qIzUI/AAAAAAAAAQc/1MfQi-BqSBk/s640/IMG_1581.JPG,,"In 1923, the people of Yokohama sent us an eight-ton stone lantern as a thank-you for offering help after an earthquake killed thirty thousand Yokohamans. Two decades later, our bombs killed another eight thousand in that city. Nine decades later, the lantern stands amid Japanese maple and Pacific rhododendron; the scents of dogshit, human urine, and sun-wilted summer flowers swirl around it. The taiko-gata lantern was a gift, an oxidized plaque tells us, “symbolizing the peace and good-will that exists between Japan and the United States.”","In 1923, the people of Yokohama sent us an eight-ton stone lantern as a thank-you for offering help after an earthquake killed thirty thousand Yokohamans.",Yokohama Taiko-Gata Lantern,"Wendy Call, 2012",47.54976,-122.257427,?,culture
Images (2) & Text,,,,,,N,https://lh3.googleusercontent.com/-WVjLlF6m0QY/VAqNS1g1VbI/AAAAAAAAASs/ebS0q9aTmIY/s800/ClayStudioWPAsign.jpg ,https://lh5.googleusercontent.com/-l6WxUHEo6FE/VAqNUewl5bI/AAAAAAAAAS0/wVkZTYi4pjI/s912/AndrewsBay2012.jpg,"Turn to the east, face our past. Turn to the west, face your reflection.","Turn to the east, face our past. Turn to the west, face your reflection.",At the Clay Studio,"Wendy Call, 2014",47.55153,-122.25725,N,culture
Image & Text,,,,,,N,https://lh5.googleusercontent.com/-brrqjzTEO9E/VAqNWhuwxWI/AAAAAAAAARc/UvvoLYSGbec/s512/BathroomSkylight.jpg,,Bathroom view of Southeast Seattle sky: Moss molders. Leaves linger.,Bathroom view of Southeast Seattle sky: Moss molders. Leaves linger.,Women's Room,"Wendy Call, 2014",47.549759,-122.256475,,ecology
Image & Text,,,,,,N,http://cdn.c.photoshelter.com/img-get/I0000drj78Ba9TxY/s/900/900/Mt-Rainier-Seward-Park-Seattle-9768.jpg,http://digitalcollections.lib.washington.edu/utils/ajaxhelper/?CISOROOT=imlsmohai&CISOPTR=7225&action=2&DMSCALE=90&DMWIDTH=512&DMHEIGHT=463&DMX=0&DMY=0&DMTEXT=&DMROTATE=0,"People shout at one another; sausage dogs trot on tangled leashes; kids feel the sting of hand-slaps and lip-tsks. (“You are not an adult!”) Over it all, over Lake Washington, Tahoma hovers impervious and imperial. Our land bows down to our mountain. Vine maple branches frame mountain peak, Mercer Island hunches to the east and Rainier Beach bumps to the southwest.",People shout at one another; sausage dogs trot on tangled leashes; kids feel the sting of hand-slaps and lip-tsks.,"Rainier, Bikerack View","Thomas Bancroft, 2014 and 1900 photo courtesy of Museum of History and Industry",47.549564,-122.256661,,ecology
Image & Text,,,,,,N,https://lh4.googleusercontent.com/-KcQikMAOHKg/VIVT9ock1KI/AAAAAAAAAiI/26-D0kBTgVc/s512/Bedrock.JPG,,"Alki Beach and Seward Park, cardinal points on city’s east-west axis, are connected by an invisible, treacherous line: the Seattle fault. An eon ago, an earthquake sent forests sliding into Lake Washington and a twenty-foot cliff bursting from Bailey Peninsula's soil. Here on Sqebeqsed's north flank, as at Alki, the quake broke bedrock though clay and moss, bared to the dim eye of Northwestern sky.","Alki Beach and Seward Park, cardinal points on city’s east-west axis, are connected by an invisible, treacherous line…",Earthquake Scar(p),"Wendy Call, 2014",47.555245,-122.254493,N,landscape
Audio Link & Text,https://soundcloud.com/brainpicker/denise-levertov-reads-open-secret-1991,http://www.english.illinois.edu/maps/poets/g_l/levertov/oconnell.htm,her final interview,,,,http://cdn.c.photoshelter.com/img-get/I0000y2oNWCCjQ_o/s/900/900/Mt-Rainier-with-ducks-Seward-Park-Seattle-9775.jpg,,"In the last interview of her life, poet Denise Levertov said of Mount Rainier, ""When it's out, I can see it from my work room and my kitchen window. I usually take paper and pencil in my pocket when I go down to the park. Often something starts as I'm walking around there."" In her poem ""Open Secret,"" she wrote of only wanting to view her Tahoma from afar: ""This one is not, I think, to be known / by close scrutiny, by touch of foot or hand / or entire outstretched body."" ","In the last interview of her life, poet Denise Levertov said of Mount Rainier, ""When it's out, I can see it from my work room and my kitchen window….""",Levertov's Rainier,"Thomas Bancroft, 2014",47.54877,-122.25645,N,landscape
Link & Text,,http://poems.com/special_features/prose/essay_warn.php,writes of Mount Rainier's influence on Denise Levertov,,,,http://digitalcollections.lib.washington.edu/cdm/singleitem/collection/seattle/id/1578/rec/26,,"Seattle poet Emily Warn writes of Mount Rainier's influence on Denise Levertov, one of the most famous poets ever to live in Seattle: ""If 'Nature' in her poetry is a metonymy for spiritual understanding, then 'the mountain' stands for a divine presence hidden within, yet not of this material world....""","Seattle poet Emily Warn writes of Mount Rainier's influence on Denise Levertov, one of the most famous poets ever to live in Seattle….",Divine Presence,"Emily Warn, 2011 and Asahel Curtis, 1914",47.549841,-122.249755,N,culture
Image & Text,,http://spectatorspots.blogspot.com/2012/06/we-come-looking.html,"wrote a short essay, ""We Come Looking,""",,,Y,https://lh4.googleusercontent.com/-Xc65nmKJFOE/VAqNexWarzI/AAAAAAAAATE/pZhjCjL9QBY/s576/IMG_3088.JPG,,"Over three summer Saturdays in 2012, I walked with two dozen writers through trail and brush, offering them a writing and nature tour of the Sqebeqsed Peninsula. One of those writers, Kristianne Huntsberger, wrote a short essay, ""We Come Looking,"" during our walk.","Over three summer Saturdays in 2012, I walked with two dozen writers through trail and brush, offering them a writing and nature tour of the Sqebeqsed Peninsula. ",A Writing Spot,"Kristianne Huntsberger and Wendy Call, 2012",47.555297,-122.254394,,culture
Image & Text & Link,,http://depts.washington.edu/uwcrows/,some ornithologists celebrate them,,,Y,http://cdn.c.photoshelter.com/img-get/I0000gcOguCU6ejo/s/900/900/American-Crow-portrait-Seward-Park-Seattle-9687.jpg,,"A century ago, Audubon Society members dreamed of keeping crows out of Seward Park. Now, some ornithologists celebrate them. At my house, a twenty-five minute walk uphill Sqebeqsed, the crows migrate late every afternoon to the southeast, toward Seward Park. Black forms angle and twist past our windows. Each Wednesday, they lecture me with their cawing as I carry out the garbage. The following morning, the top has been popped from the container and the garage lies strewn. Worked clean. ","A century ago, Audubon Society members dreamed of keeping crows out of Seward Park. Now, some ornithologists celebrate them.",American Crow,"Thomas Bancroft, 2014",47.548889,-122.256389,,ecology
Image & Text,,,,,,Y,http://cdn.c.photoshelter.com/img-get/I0000Rqic3mwa2Dw/s/900/900/Hawthorn-berries-Seward-Park-Seattle.jpg,,"Botanist David Douglas' black hawthorn, or thornapple, grows below forest treetops from Alaska to the Great Plains. ""Montana Indian Food,"" some called it. The hard wood became tool handles; the thorns, fishhooks and ear-piercing needles. Seward Park birds find refuge from barking dogs in black hawthorn's thorny thicket. ","Botanist David Douglas' black hawthorn, or thornapple, grows below forest treetops from Alaska to the Great Plains. ",Hawthorn Berries,"Thomas Bancroft, 2014",47.553611,-122.250556,,ecology
Image & Text,,,,,,N,http://cdn.c.photoshelter.com/img-get/I0000P0OCn0WSZAA/s/900/900/High-Bush-Craneberry-Seward-Park-Seattle.jpg,,"Is not a cranberry at all, but a Viburnum, an immigrant from Europe, and Africa before that. A map of its North American distribution is a paint-splatter covering all of northern New England, Michigan and Wisconsin, with smears and small dots farther west and south. It hitchhiked from New England across the plains, deciding to stay in small spots of western Montana, northeastern Washington, southern New Mexico, and here on Sqebeqsed Peninsula. ","Is not a cranberry at all, but a Viburnum, an immigrant from Europe, and Africa before that.",High Bush Cranberry,"Thomas Bancroft, 2014",47.551111,-122.250833,,ecology
Image & Text,,,,,,Y,http://cdn.c.photoshelter.com/img-get/I0000kFIPNWL0xbU/s/900/900/Glaucous-winged-Gull-Seward-Park-Seattle-9761.jpg,,"More than anything, we come here to eat. McDonalds bags and Starbucks cups catch in lakeside bramble. Early morning, young not-yet-bald eagle hunts low over Andrews Bay from his lookout north of the Clay Studio, crows admonishing each failed swoop. Picnic blanket patchworks hold blue-frosted cakes in plastic bubbles and chafing trays of lumpia. Rafts of widgeons dabble at lake grass, their squeeze-toy voices skimming from water to land. Plumes of meat-soaked smoke and bass-soaked radiowaves rise from mid-park picnic shelters. At dusk, a barred owl dismembers a vole, tuft by tuft. ","More than anything, we come here to eat. McDonalds bags and Starbucks cups catch in lakeside bramble. ",Glaucous Winged Gull Feeds in Shallow Water,"Thomas Bancroft, 2014",47.548808,-122.256442,,ecology
Image & Text,,,,,,Y,http://cdn.c.photoshelter.com/img-get/I0000TKsIYVed2cM/s/900/900/Seward-Park-Trail-Seward-Park-Seattle-1645.jpg,,"“I have seen the salmon going up the Duwamish so thick they were a moving mass of fins. We could scoop them up and barrel them. The Indian potatoes were good though small. For twenty years I shot all the venison I cared for; grouse and other game filled the woods; and with clams and oysters we had all we wanted. It was much easier to get through the woods then. The Indians were extremely careful of fire so there was no underbrush which always follows a fire, only a thick moss on the ground which made it easy to get through the woods, and the trail to the Sound through the high trees was finer to me than the finest buildings now.” Walter Graham, the man who owned much of the Sqebeqsed Peninsula in the late nineteenth century.","“I have seen the salmon going up the Duwamish so thick they were a moving mass of fins. We could scoop them up and barrel them.""",Sqebeqsed Trail,"Thomas Bancroft, 2014",47.556667,-122.251944,,ecology
Image & Text,,,,,,N,http://cdn.c.photoshelter.com/img-get/I0000oD1aRx_6ofk/s/900/900/Sunrise-at-Seward-Park-Seward-Park-Seattle.jpg,,"Sqebeqsed’s soil is a thin frosting over Vashon Till, a natural concrete of silt, sand, gravel and clay. Sqebeqsed’s hardpan absorbs poorly; its air absorbs well. Landscape planners talk about “visual absorption” – a landscape’s “ability to absorb the visual impact of structures and human activities.” That definition, and the concept it explains, struck me like a thrown stone the first time I heard it. It rearranged my sense of place and my sense of this place. As a writer, much of my work is attempting to discern what others see in a place. How could Seward Park have a particular “visual absorptive capacity”? Through whose eyes do those landscape planners see? Denise Levertov quotes Mark Rudman: “The world is not something to look at, it is something to be in.”","Sqebeqsed’s soil is a thin frosting over Vashon Till, a natural concrete of silt, sand, gravel and clay. ",Sunrise at South Beach,"Thomas Bancroft, 2014",47.550278,-122.248333,,landscape
Text,,,,,,,,,"The beginning of a one-act play, Pinoy Hill, Seward Park, 1957, by Robert Francis Flor

Scene I (Pinoy Hill in Seward Park, Seattle. 1957. Three picnic tables placed in a row. The table at one end is marked with a RESERVED sign. A teen boy sprawls across the center table.)

MAX:  (Acts bored. Swears.) Why me? So unfair. (Pounds table.) It’s the same every year. Boring. Same old dances. Same old table. Same music. Same faces.  BORING! (Lies down on bench next to table and closes eyes.)

An older Pinay woman (late-forties to early fifties) enters. She carries a shopping bag. Noticing him, she makes disgusted grunting and grumbling noises and mutters as she puts the bag on the remaining, unreserved table.)

ROSARIO: Psst! Psst!

MAX: (Doesn’t respond. Ignores her.)

ROSARIO: Psst! Halo! Magandang umaga sa iyo! (Max continues to ignore her.)  Boy!  I said “Halo!”

MAX: I don’t understand Filipino. An’ I’m not a boy.

ROSARIO: Oh, American-born. I see.  I said “Hello. Good morning.”

MAX: (Sits up.) Can I help you?

ROSARIO: Are you saving that table?  I would like it.

MAX: (Stands)  No can do, Auntie.

ROSARIO: Ha?  Why “no can do”?  You’re the only one here. You use it just for sleep. My family is coming.

MAX: My dad would kill me if I gave up this table. I’m saving it for my family. It’s his orders.","An excerpt from ""Pinoy Hill,"" a play by Robert Francis Flor",Pinoy Hill - A Play,"Thomas Bancroft, 2014",47.551975,-122.255494,,culture
Text,,,,,,,,,"In a circle of vine maples, encircled today by black-and-yellow caution tape: ""Put your left hand on top of your right, pull down. And if you want to stop, just let go. Are you doing alright?"" The only adult in the group says, “I am pretty terrified.” They swing in harnesses, suspended from high vine-maple branches in their own, private rope swings. One boy hoists himself nearly to treetop, alights, and climbs around in tree-sky. “Oh, wow. How high is he up there?” ""He’s probably about at fifty feet. That’s like standing on top of a telephone pole. OK, kids, you’ve got fifteen minutes left."" Some hoist higher; some are more than ready to return to earth. The tree-swingers have drawn a small crowd: a family of three and an older couple with matching white sun hats. A great blue heron stands pencil-slim on a South Bay piling. The boy who climbed to top-of-telephone-pole height, skims to the ground and leaps from his harness. “I had a piece of bark in my pants. How did that happen?” 
Another boy swings fifteen feet off the ground, feet up, head down. ""Anybody remember what kind of tree you’re in?"" Only one does; the other children cheer. Two men jog by, one pushing a stroller, talking of 30K and 60K races. The climbing-swinging children are replaced by another group ready to harness up. Still, the heron waits.","In a circle of vine maples, encircled today by black-and-yellow caution tape: Put your left hand on top of your right, pull down.",At the Vine Maples,"Wendy Call, 2014",47.548803,-122.256936,,culture
Image &Text,,,,,,N,https://lh4.googleusercontent.com/-IraGuCoWVoA/VAqNPOxBwxI/AAAAAAAAAQ0/YOqE26Q3Lws/s720/IMG_2244.JPG,,"You are forever close to speciessong and earthstench. Songs of speed walkers, Pacific wrens, plodding joggers, chestnut-backed chickadees, radios from yachts moored offshore. Shitscents of dog, mallard, toddler, Canada goose. Crows in the round-crowned garry oaks send down drifts of pollen and scraps of moss as they flap indignant wings. Walkers move at all speeds, carrying pocketbooks, or wrist weights, or a white parasol, or the leash of a loping Labrador. Far off, twin Jet-Skis whine; nearby, a solitary fire-orange wasp buzzes thimbleberry.",You are forever close to speciessong and earthstench. ,Garry Oak Prairie,"Wendy Call, 2014",47.549232,-122.252981,,ecology
Image & Text,,,,,,N,https://lh4.googleusercontent.com/-dHPc0KFLzUA/VAqNLOzl8yI/AAAAAAAAAQk/rBdKA3zRBLk/s640/IMG_1604.JPG,,"Clarence Dayton Hillman sold housing plots in the middle of Greenlake before he moved on to developing the neighborhood that still bears his name: Hillman City. He planted burdock and Himalayan blackberry (not from the Himalayas, but from Armenia) to green clear-cut plots. In the last decade, many thousands of hours of pulling by gloved (but still painfully scratched) hands have tried to undo Hillman’s folly. ",,Poison Oy,"Wendy Call, 2014",47.549236,-122.252372,,culture
Link & Text,,http://pugetopolis.blogspot.com/2009/11/reading-at-seward-park.html, writers who has been inspired by Seward Park,been inspired by Seward Park,,,,,"Knute Berger, ""Mossback,"" is one of the Northwest's writers who has been inspired by Seward Park over a half-century of visits.","Knute Berger, ""Mossback,"" is one of the Northwest's writers who has been inspired by Seward Park over a half-century of visits.",Mossback,"Knute Berger, 2011",47.549722,-122.256389,,culture
Image & Text,,,,,,,http://cdn.c.photoshelter.com/img-get/I00008oMmkkItv8c/s/900/900/Seward-Park-Seattle-1618.jpg,,"Trip Vine Crossing marks the entry to the Magnificent Forest. ""Bailey Peninsula, southeast of the city, forms the most available large tract of land that is uniformly and beautifully covered with woods, and should be secured eventually, and, of course, before the woods are injured."" -- Olmstead Brothers 1908 report","""Bailey Peninsula, southeast of the city, forms the most available large tract of land that is uniformly and beautifully covered with woods..."" ",From the Park Commissioners' Report,"Olmstead Brothers, 1908",47.554722,-122.250278,,landscape
Image & Text,,,,,,N,https://lh5.googleusercontent.com/-CmxSJUQHYYA/VIT1YGEIu0I/AAAAAAAAAVk/a6mcGQ0RjBE/s720/Julie%26HeidiWriting.JPG,,"Julie Chinitz and Heidi Stahl participate in my writing workshop in June 2012. Julie has run the nine-mile loop from her house in the Central District to Seward Park for years. When asked to name the most personally important place in the park, she says, ""The water fountain?""",Julie Chinitz and Heidi Stahl participate in my writing workshop in June 2012.,Word-working,"Wendy Call, 2012",47.561696,-122.254172,,culture
Image & Text,,,,,,N,https://lh5.googleusercontent.com/-YQzZQaSt4O4/VIT-XFvIjvI/AAAAAAAAAYY/gcwOTOPCsiA/s720/ViewfromLifeguardChairAndrewsBay.JPG,,"At the Andrew's Bay beach, climb into the lifeguard's chair. This is the place where much of what you are reading here, at Sqebeqsed Stories, was written.","At the Andrew's Bay beach, climb into the lifeguard's chair. This is the place where much of what you are reading here, at Sqebeqsed Stories, was written.","Field Office, with a View","Wendy Call, 2012",47.551389,-122.2575,,culture
Link & Text & Image,,http://www.sewardpark.org/history.html,was born on the shores of Lake Washington,,,Y,http://digitalcollections.lib.washington.edu/cdm/singleitem/collection/loc/id/1263/rec/5,,"Kick-is-om-lo, Chief Seattle's daughter, who later came to be known as Princess Angeline, was born on the shores of Lake Washington south of the Sqebeqsed Peninsula, near what we now call Atlantic Park, but was then called Tuxwoo'kwib, Place of the Loons.","Kick-is-om-lo, Chief Seattle's daughter, who later came to known as Princess Angeline, was born on the shores of Lake Washington south of the Sqebeqsed Peninsula…",Princess Angeline's Birthplace,Friends of Seward Park,47.542557,-122.260952,,culture
Image & Text,,,,,,N,https://lh6.googleusercontent.com/-3bXvyUZq9xU/VIT_XQrkWbI/AAAAAAAAAZM/SiJ0w50qhfc/s503/SDT1981Bridge.jpg,,"For a half-century, from the 1930s to the 1980s, developers threatened to build a bridge from Seward Park to Mercer Island. In the 1930s, the plan was to build it from this point on the south side of the park. A half century later, the planned location had moved south of the park. Imagine: the view of Mount Rainier slashed by a bridge.","For a half-century, from the 1930s to the 1980s, developers threatened to build a bridge from Seward Park to Mercer Island.",Bridge to Mercer Island?,"Seattle Times, 1981",47.553147,-122.246651,N,landscape
Image & Text,,,,,,N,https://lh4.googleusercontent.com/-WETKxp7P-Io/VIT19280uNI/AAAAAAAAAWE/Lu94Bkh2bcM/s800/SewardFernColumbine.JPG,,"""I wish more folks understood. There are humane societies for dogs and kittens. They can cry when they are hurt. These flowers, too, are living things, but have no way to protest or escape. I wish all children might be taught to plant, and to protect."" --Jacob L. Umlauff, long-time Seattle Parks gardener, 1930 (Mr. Umlauff planted invasive holly, too.)","""The flowers, too, are living things, but have no way to protest or escape.""",A Voice for Flowers,Seattle Daily Times,47.549722,-122.256667,,culture
Image & Text,,,,,,Y,https://lh4.googleusercontent.com/-yt4RN3WTvic/VIUz2lDI8FI/AAAAAAAAAZg/cwcRgu1wu9k/h120/Salal-Seward%2BPark-TBancroft.jpg,,"""Of course all the men detest everything wild except the big leaved maple tree and madronas. Bushes are to them merely weeds to be trampled down and destroyed so grass can be grown. It seems especially queer that they cannot appreciate the beautiful evergreen undergrowth they have here--the Oregon grape, the Sallal, and the evergreen huckleberry."" --John Charles Olmstead, 1908","""It seems especially queer that they cannot appreciate the beautiful evergreen undergrowth they have here....""",Salal,"Thomas Bancroft, 2014",47.554203,-122.250115,,landscape
Text & Image & Link,,http://www.historylink.org/index.cfm?DisplayPage=output.cfm&file_id=3141,a quarter-million trout swam from Seward Park hatchery ponds,,,N,https://lh6.googleusercontent.com/-Ex6XmpBV04g/VIVRbLukYgI/AAAAAAAAAZ0/a1U4kSBMnEw/s583/FishPonds1945newspaperphoto.jpg ,,"In the mid-1940s, a quarter-million trout swam from Seward Park hatchery ponds into Lake Washington every year. By the 1970s, we understood that fishermen's paradise as pollution.","In the 1940s, a quarter-million trout swam from Seward Park hatchery ponds…",Swimming in Pollution,"Seattle Times, 1945 & Wendy Call, 2014",47.556111,-122.251111,,culture
Image & Text,,,,,,N,https://lh6.googleusercontent.com/-USbyCEsEtx4/VIVdIo8aCFI/AAAAAAAAAbk/MqRfOzKwk3c/s576/EagleHuntingTree.JPG,,"A young bald eagle sweeps so low overhead I feel its wind and smell its feathers. In August, the nest's two fledglings are still unsteady on branch and wing. If lumbering were possible on air, this huge brown bird would be lumbering. It swoops to an unsteady landing on a tenuous branch, just below another young bald eagle. Second bird hops up to perch by its sibling. Together, they tear at the tree-growth around them, raining leaf-litter down onto my face, onto tree roots and blackberry, onto someone’s left-behind paper napkins and a yellow ""WARNING buried cable"" sign.","A young bald eagle sweeps so low overhead I feel its wind and smell its feathers. In August, the nest's two fledglings are still unsteady on branch and wing. ",Eagle Hunting Roost,"Wendy Call, 2014",47.560556,-122.255,,ecology
Text & Image & Link,,http://dartofphysics.ie/physics-darts/we-are-all-made-stardust,were forged by dying stars,,,N,https://lh6.googleusercontent.com/-Oq7FFyn8dmQ/VIVdXHn4kfI/AAAAAAAAAb0/4JGqqBTa8mo/s720/CampFireStardust%26Leaf.JPG,,"The land we walk here and everywhere, the madrona and thimbleberry, our own bodies resting or sweating, are all made of stardust. The atoms of all earthly bodies were forged from dying stars.","The land we walk here and everywhere, the madrona and thimbleberry, our own bodies resting or sweating, are all made of stardust. The atoms of all earthly bodies were forged from dying stars.",Made of Stardust,"Wendy Call, 2014",47.549444,-122.249722,,ecology
Text & Image & Link,,http://www.historylink.org/index.cfm?DisplayPage=output.cfm&file_id=3172,"Forty-five years later, the first Black family finally moved in",,,N,https://lh6.googleusercontent.com/-6PgB2OCvXYE/VIYYaTYCFeI/AAAAAAAAAdA/tg92tOXWM0c/s720/IMG_2415.JPG,,"In 1925, Seattle developers planned a new neighborhood on the steep hills west of Seward Park. Forty-five years later, the first African American family built a house there--despite their neighbors' best efforts to keep them out. Owned by the family of Dr. John Henry, a surgeon, the house was designed by African American architect Benjamin McAdoo. That house was torn down and replaced by this one: a guest house for the family that lives across the street.",house there…,Seward Park Uplands: Showplace of the (Racist) West,"Seattle Daily Times, 1925",47.545,-122.259167,,culture
